title,company,location,description,skills
Computer Scientist Jobs,BAE Systems,"Reston, Virginia",job description every action bae system serf higher purpose protecting protect u unwavering commitment safeguarding life defending freedom fuel collective passion join purpose driven community every effort count every contribution resonates globally bae system seeking computer scientist support government customer reston va patrick space force base fl computer scientist working classified environment employ mathematics statistic information science artificial intelligence machine learning network science probability modeling data mining data engineering data warehousing data compression data protection scientific technique correlate complex technical finding graphical written visual verbal narrative product trend existing intelligence data leverage ic data source responsibility include identify capture track assist execute establishment new osint pai capability training data subscription requirement working officer dia mission directorate combatant command service dod osint stakeholder assist vetting validation design testing process osic capability requirement provie technical expertise required osint pai data requirement acquisition assist development deployment security approval osic capability service provide technical expertise required osint user interface user experience data requirement acquisition provide technical expertise required scrum sprint capability data requirement software acquisition develop utilize machine learning data mining algorithm including limited multiple information model synthesis architecture mimosa prediction algorithm based open source capability integrate code algorithm support government intelligence search discovery mission assist development automated capability aggregate license information dissemination license report briefing create brief senior leadership detailing nuance account license management metric assist design maintenance logical physical data model relational dimensional data dictionary database volumetrics work define basic file organization indexing method security procedure specific user application maintains database dictionary monitor standard procedure integration system database design close supervision maintains accurate date knowledge database information requirement maximizing database potential help provide assistance various client required database design implementation troubleshooting maintain standard documentation eks01 required education experience skill junior bachelor degree computer science 3 year computer science experience experience within last 2 year 7 year experience mid level bachelor degree computer science 8 year computer science experience experience within last 2 year 10 year experience senior master degree computer science 12 year computer science experience experience within last 2 year bachelor degree 17 year experience experience utilizing commercial shelf cot osint tool include limited berber hunter tool kit application e g silo scraawl data miner babel knowledgeable demonstrates ability apply ic dod classification guideline procedure preferred education experience skill graduate government osint training course e g u army obc os301 os302 caso defense ic equivalent dia botc fbi os101 experience conducting computer science support ic dod li to1 pay information full time salary range 75570 128480 please note range based market pay structure however individual salary determined variety factor including limited business consideration local market condition internal equity well candidate qualification skill education experience employee benefit bae system support employee aspect life including health financial well regular employee scheduled work 20 hour per week offered health dental vision insurance health saving account 401 k saving plan disability coverage life accident insurance also employee assistance program legal plan perk including discount thing like home auto pet insurance leave program include paid time paid holiday well type leave including paid parental military bereavement applicable federal state sick leave employee may participate company recognition program receive monetary non monetary recognition award incentive may available based position level job specific bae system intelligence security bae system inc u subsidiary bae system plc international defense aerospace security company delivers full range product service air land naval force well advanced electronics security information technology solution customer support service improving future protecting life ambitious mission bae system working mean using passion ingenuity count defending national security breakthrough technology superior product intelligence solution develop latest technology defend national security continually hone skill team making big impact global scale bae system find rewarding career truly make difference intelligence security based mclean virginia design delivers advanced defense intelligence security solution support important mission customer pride dedication show everything intelligence analysis cyber operation expertise system development system integration operation maintenance service knowing work enables u military government recognize manage defeat threat inspires u push technology new level position posted least 5 calendar day posting remain active position filled qualified pool candidate identified,N/A
Computer Scientist,Department of the Air Force - Agency Wide,"Washington, District of Columbia",click learn agency button important additional information direct hire solicitation public notice gather application may may result referral selection,N/A
Cryptologic Computer Scientist-2,Leidos,"Odenton, Maryland",description leidos new exciting opportunity cryptologic computer scientist national security sector n cyber analytics business area caba talented team forefront security engineering computer network operation cno mission software analytical method modeling signal intelligence sigint cryptographic key management leidos offer competitive benefit including paid time 11 paid holiday 401k 6 company match immediate vesting flexible schedule discounted stock purchase plan technical upskilling education training support parental paid leave much join u make difference national security job summary looking interesting meaningful way apply knowledge talent corporate vision leidos global leader development application technology solve customer demanding challenge looking cryptologic computer scientist join team fort meade maryland supporting development operation miss opportunity take career next level part innovative dynamic environment apply job responsibility qualification mission focus design develop deliver operate solution hard cryptologic computer science problem within scientific framework use state art technique tool approach range computer science skill operating system compiler theory database theory algorithm analysis computer architecture discrete math programming language theory data structure technical proficiency develop solution problem set forensics attack attribution protection critical network active system warning indicator active penetration target system knowledge discovery passive active system cryptologic computer science mission support qualification bachelor degree plus 5 year relevant experience master degree plus 3 year relevant experience doctoral degree 2 year relevant experience associate degree plus 7 year relevant experience may considered individual depth experience clearly related position security clearance requirement candidate must posse active t sci polygraph clearance considered role desirable skill relevant experience computer system research simulation model development prototyping software design programming computational science algorithm analysis design reverse engineering designing developing computer information system including engineering hardware software leidos opportunity boundless challenge staff interesting assignment allow thrive professionally personally u helping grow career good business look forward learning apply today career leidos com conmd original posting april 16 2025 u position subject change based business need leidos reasonably anticipates job requisition remain open least 3 day anticipated close date earlier 3 day original posting date listed pay range pay range 85 150 00 153 925 00 leidos pay range job level general guideline guarantee compensation salary additional factor considered extending offer include limited responsibility job education experience knowledge skill ability well internal equity alignment market data applicable bargaining agreement law,N/A
AI/ML Data Scientist,Innovative Defense Technologies (IDT),"Arlington, Virginia",background information innovative defense technology idt provider cutting edge cloud based integration automated testing data analysis complex mission critical system u department defense dod seeking ai ml data scientist based arlington va office leveraging advanced software automation model based system engineering mbse ai driven capability idt accelerates capability development enhances operational readiness reduces lifecycle cost department defense company dedicated transforming defense system innovation efficiency mission critical result overview data scientist position offer engineer opportunity utilize knowledge talent part collaborative team developing ai solution growing company responsibility include supporting feasibility study applying modern data storage technique discovering explanatory feature high dimensionality collection data exploring data using scientifically valid technique exploiting pattern found data state art ai ml dl solution applicant must able obtain maintain active u security clearance responsibility include develop solution deliver ai ml dl model problem formulation productized deployable maintainable capability use deep learning framework tensorflow kera build validate ml dl model establish leverage big data framework store extract analyze relevant data develop software solution understanding customer requirement program intent determine operational feasibility evaluating analysis problem definition requirement solution development proposed solution responsible solution meet software design quality performance requirement work minimal supervision collaborative work environment implement best class solution minimum required qualification bachelor degree computer science computer engineering electrical engineering system engineering physic math minimum 3 year experience predictive modeling data science analysis required skill previous experience ml data scientist role track record building ml dl model experience working data mining algorithm including decision tree probability network association rule clustering neural network experience using python equivalent experience using ml library scikit learn experience using data visualization tool preferred skill experience working gpus develop model experience mapreduce programming hadoop skill programming language java c c demonstrated ability develop experimental analytic plan data modeling process use strong baseline ability accurately determine cause effect relation experience application container platform familiarity continuous integration delivery tool e g jenkins familiarity version control tool e g subversion git etc familiarity vmware virtualization software experience developing application dod command control system competency solid analytical ability coupled strong sense ownership urgency drive attention detail initiative creativity reliability teamwork ability deal well ambiguity prioritize need deliver result dynamic environment pay range 90 000 150 000 114 000 184 000 amount may reflective actual compensation may earned pay dependent candidate experience skill education posted range include bonus commission tip benefit idt often looking place multiple candidate various level therefore one pay range included commensurate experience eeo statement idt equal opportunity employer,N/A
Cryptologic Computer Scientist,HII's Mission Technologies division,"Fort Meade, Maryland",requisition number 23387 required travel 0 10 employment type full time salaried exempt anticipated salary range 81 640 00 135 000 00 security clearance t sci poly level experience mid opportunity resides warfare system w business group within hii mission technology division warfare system comprises cyber mission electronic warfare c5isr system hii work within nation intelligence cyber operation community defend interest cyberspace anticipate emerging threat capability cybersecurity network architecture reverse engineering software hardware development uniquely enable u support sensitive mission u military federal agency partner meet hii mission technology division team 7 000 professional worldwide delivers domain expertise advanced technology service mission partner across globe mission technology leading next evolution national defense data evolution accelerating breadth national security solution government commercial customer capability range c5isr ai big data cyber operation synthetic training environment fleet sustainment environmental remediation largest family unmanned underwater vehicle every class find role right apply today look forward meeting learn mission technology click short video http vimeo com 732533072 summary hii seeking cryptologic computer scientist professional join cyber intelligence team work performed customer site fort meade directly collaborate data scientist cryptologic cryptanalytic programmer reverse engineer intelligence planner synergistically enable real time solution implemented speed need part cyber intelligence team engaged providing support related service implementation enterprise data representation various mission domain perform end end system engineering data flow perspective data format modeling data mapping support implementers mission customer position requires strong data science expertise cradle grave limited high level direction cyber professional defining future cybersecurity providing effective prevention detection response broad spectrum constant evolution threat actor expert provide actionable timely intelligence protects nation adversary intent disrupting freedom harming nation together integral part important mission go work every day knowledge pride accomplishment make difference design develop deliver operate solution hard cryptologic computer science problem within scientific framework solution may arise form forensics attack attribution protection critical network active system warning indicator active penetration target system knowledge discovery passive active system cryptologic computer science mission support requisite computer science skill operating system compiler theory database theory algorithm analysis computer architecture discrete math programming language theory data structure applied problem provide state art technique tool approach looking 2 year relevant experience bachelor related field 0 year experience master related field high school diploma equivalent 6 year relevant experience clearance must posse maintain t sci poly listed salary range role intended good faith estimate based role location expectation responsibility extending offer hii mission technology division take variety factor consideration include limited role function candidate education training work experience key skill together working ensure future everyone free thrive qualified applicant receive consideration employment without regard race color religion gender gender identity expression sexual orientation national origin physical mental disability age veteran status basis protected federal state local law need assistance need reasonable accommodation part employment process please send e mail buildyourcareer hii co com let u know nature request contact information reasonable accommodation considered case case basis please note inquiry concerning request reasonable accommodation responded email address additionally may also call 1 844 849 8463 assistance press 3 hii mission technology,N/A
Computer Science and Software Engineering Intern,MITRE Corporation,"McLean, Virginia",position computer science software engineering intern mitre full time position aimed student pursuing degree software engineering computer science related field intern work significant national challenge applying technology enhance naval aviation solution ensuring warfighter dominance role offer unique opportunity gain hand experience collaborative innovative environment contributing meaningful project impact national security responsibility apply technology solve problem national significance conduct computer science algorithm analysis benchmark performance engage processor cpu gpu fpga programming requirement must student enrolled full time accredited degree program software engineering computer science related field sustained excellence academic performance exposure software development tool framework including source control management tool e g git familiarity software development methodology ability obtain maintain secret clearance nice have experience applying computer science learning internship research lab position experience matlab python similar modeling analytic tool processor programming benchmarking experience possession secret clearance benefit competitive benefit exceptional professional development opportunity culture innovation embrace diversity inclusion flexibility collaboration career growth,N/A
Cryptanalytic Computer Scientist Level 2,Nyla Technology Solutions,"Annapolis Junction, Maryland",job description active security clearance t sci polygraph level required pursuing individual position cryptanalytic computer scientist 2 position sound like good fit track record delivering solid result please apply annual base salary range role 119 000 144 000 usd include discretionary bonus compensation comprehensive benefit package actual compensation offered successful candidate may vary posted hiring range based upon geographic location work experience education skill level among thing required skill tsr need developer type come work techelint data help build new capability understanding python minimum qualified candidate posse following capability bachelor degree 5 year relevant experience master degree plus 3 year relevant experience doctoral degree 2 year experience associate degree plus 7 year relevant experience may considered individual depth experience clearly related position degree must computer science computer engineering electrical engineering mathematics including applied math related field e engineering math least one programming least four upper level math class calculus relevant experience must computer science area e theoretical applied designing developing using evaluating mathematic model method technique e g algorithm development study issue solve problem engineering electrical computer high performance computing nyla technology solution nyla technology solution delivers exceptional artificial intelligence ai data science software engineering service u government nyla embrace forward thinking bold approach every turn earning u solid reputation technical trendsetters within industry passion developing solution quick immediate impact mission headquartered columbia maryland customer love tackle challenging problem get thing done unique experience expertise seeking along desire determination invest time energy part nyla team taking care nyla provides top market compensation benefit package unique nyla flex program custom tailor benefit best fit lifestyle nyla flex benefit program designed offer flexibility 3 biggest area life pay leave schedule pay nyla start 4 week annual leave plus 11 holiday additional day annual leave year company flexibility cash annual leave hour opt nyla benefit arrange additional hour contract 40 hr week even option earn 1 3 time hourly rate work 1880 hour contract leave want spend time family want time travel world buy additional annual leave total 6 week annual leave 240 hour leave plus 11 holiday even including paid anniversary leave schedule traditional 40 hour workweek longer fit lifestyle nyla flex freedom scale 30 32 hour still enjoying top notch nyla benefit know love flexibility work without compromising perk benefit nyla health care medical dental vision 100 covered company provide 10 401k matching full vesting day 1 professional development offer 5 000 per year used towards fee tuition time continued growth even student loan repayment program provide 8 hour volunteering annually support community making world better place learn nyla culture exceptional benefit package click nyla equal opportunity employer,N/A
Cloud Computing Engineer SME,KBR,"Chantilly, Virginia",title cloud computing engineer sme belong connect grow kbr kbr national security solution team provides high end engineering advanced technology solution customer intelligence national security community position work profound impact country critical role protecting national security join u innovative project kbr work forefront engineering logistics operation science program management mission cybersecurity solution collaborative environment part dynamic team thrives collaboration innovation fostering supportive intellectually stimulating workplace impactful work contribution pivotal designing optimizing defense system ensure national security shape future space defense kbr seeking highly qualified cloud computing engineer support customer chantilly va delivers mission critical capability directly supporting intelligence gathering mission overhead system contingent position based upon contract award responsibility experience expertise adopting integrating cloud architecture cloud enabled platform experience using agile devsecops modem software factory practice separate data application use apis microservices emphasize continuous software development deployment able identify evaluate recommend architectural improvement opportunity fga 2 0 future ground architecture maximizing data centricity application service centric concept cloud use software framework microservices apis application skilled development maintenance reference cloud architecture design pattern evaluate make recommendation ensure agency architecture maximize use cloud service align fga 2 0 vision collaborate cross functional team including developer operation security personnel ensure alignment architecture decision implementation approach documenting design choice configuration procedure facilitates knowledge sharing future troubleshooting duty assigned required skill active t sci polygraph bachelor science degree computer science related stem field 10 year experience software engineering strong knowledge enterprise computing operating system o cloud computing platform linux window microsoft azure amazon web service aws cloud based solution experience leveraging large cloud computing infrastructure platform architecting engineering developing deploying system application cloud environment strong problem solving skill ability work effectively fast paced collaborative environment excellent communication skill written verbal ability convey complex security concept technical non technical stakeholder clearance t sci clearance polygraph belong connect grow kbr kbr passionate people zero harm culture inform heart commitment ongoing journey toward people first company commitment central team team philosophy foster environment everyone belong connect grow deliver together kbr equal opportunity employer qualified applicant receive consideration employment without regard race color religion disability sex sexual orientation gender identity expression age national origin veteran status genetic information union status belief characteristic protected federal state local law,N/A
